{"run":21,"commit":"TBD","metric":8.337,"metrics":{"eta_errors":0,"eta_h1_get_1k_ms":0.04,"eta_h2_get_1k_ms":0.097,"eta_h2_get_1m_ms":3.328,"eta_h2_post_1m_ms":4.872,"go_h1_get_1k_ms":0.016,"go_h2_get_1k_ms":0.033,"go_h2_get_1m_ms":0.406,"go_h2_post_1m_ms":2.248,"go_total_ms":2.704},"status":"discard","description":"Revert: 64KB H2 read_buffer_size + 128KB reader buffer — H2 GET 1M regressed (2.89→3.33ms), H2 GET 1k regressed (0.05→0.10ms)","timestamp":1779700103897,"segment":0,"confidence":2550.748780487804,"asi":{"hypothesis":"Increasing H2 read_buffer_size to 64KB and reader buffer to 128KB would reduce frame count and improve H2 large-body performance.","next_action_hint":"Add per-phase timing to benchmark to understand where H2 GET 1M time is spent (request vs body vs overhead).","rollback_reason":"H2 GET 1M regressed from 2.89ms to 3.33ms, H2 GET 1k regressed from 0.05ms to 0.10ms. Larger frames hurt performance unexpectedly."}}
{"run":22,"commit":"126e4a1","metric":7.749,"metrics":{"eta_errors":0,"eta_h1_get_1k_ms":0.038,"eta_h2_get_1k_ms":0.045,"eta_h2_get_1m_ms":2.926,"eta_h2_post_1m_ms":4.74,"go_h1_get_1k_ms":0.017,"go_h2_get_1k_ms":0.023,"go_h2_get_1m_ms":0.452,"go_h2_post_1m_ms":1.756,"go_total_ms":2.25},"status":"keep","description":"perf: Informational_filter offset optimization + skip-schedule_read in body_stream_async (7.75ms total)","timestamp":1779702156456,"segment":0,"confidence":2582.7358024691284,"asi":{"hypothesis":"Two optimizations: (1) Use offset tracking in Informational_filter to eliminate O(N^2) string copying of remaining data after each frame. (2) Skip unnecessary schedule_read calls in body_stream_async when the event queue already has chunks.","next_action_hint":"The H2 GET 1M gap (2.93ms vs Go 0.45ms) is still the dominant bottleneck. Need to determine if it's TLS decryption (ocaml-tls) or H2 frame processing. Add a temporary h2c (plain H2) GET 1M scenario to isolate TLS overhead.","hypothesis_tested":"Informational_filter offset + skip-schedule_read"}}
{"run":23,"commit":"eb9ca42","metric":7.136,"metrics":{"eta_errors":0,"eta_h1_get_1k_ms":0.037,"eta_h2_get_1k_ms":0.053,"eta_h2_get_1m_ms":2.512,"eta_h2_post_1m_ms":4.534,"go_h1_get_1k_ms":0.018,"go_h2_get_1k_ms":0.036,"go_h2_get_1m_ms":0.438,"go_h2_post_1m_ms":1.948,"go_total_ms":2.44},"status":"keep","description":"perf: patch tls-eio recv_buf from 4KB to 256KB to reduce TLS read syscalls and decryption overhead (7.14ms total, best yet)","timestamp":1779702621011,"segment":0,"confidence":2616.552499999998,"asi":{"hypothesis":"tls-eio's hardcoded 4KB recv_buf causes many read_react calls for large TLS transfers. Increasing to 256KB reduces syscall/TLS overhead.","next_action_hint":"Try even larger recv_buf (1MB) or look for other TLS optimizations. The remaining TLS overhead (~2.1ms for 1MB) is likely inherent to ocaml-tls crypto speed vs Go's assembly-optimized crypto.","hypothesis_tested":"tls-eio recv_buf 256KB patch"}}
{"run":24,"commit":"TBD","metric":8.47,"metrics":{"eta_errors":0,"eta_h1_get_1k_ms":0.045,"eta_h2_get_1k_ms":0.079,"eta_h2_get_1m_ms":2.877,"eta_h2_post_1m_ms":5.469,"go_h1_get_1k_ms":0.026,"go_h2_get_1k_ms":0.023,"go_h2_get_1m_ms":0.513,"go_h2_post_1m_ms":1.965,"go_total_ms":2.528},"status":"discard","description":"No code change (reverted h2_write_fixed_body_sync) — host noise check, 8.47ms vs best 7.14ms","timestamp":1779703052805,"segment":0,"confidence":2616.552499999998,"asi":{"rollback_reason":"Reverted h2_write_fixed_body_sync no-flush optimization which caused regression in POST. This confirms the per-chunk flush is needed for request-body latency."}}
{"run":25,"commit":"TBD","metric":10.606,"metrics":{"eta_errors":0,"eta_h1_get_1k_ms":0.04,"eta_h2_get_1k_ms":0.092,"eta_h2_get_1m_ms":4.572,"eta_h2_post_1m_ms":5.902,"go_h1_get_1k_ms":0.018,"go_h2_get_1k_ms":0.028,"go_h2_get_1m_ms":0.442,"go_h2_post_1m_ms":2.053,"go_total_ms":2.541},"status":"discard","description":"tls-eio recv_buf=1MB — regression, H2 GET 1M went from 2.51ms to 4.57ms. Too-large buffer causes GC/alloc pressure.","timestamp":1779703124327,"segment":0,"confidence":2434.002325581387,"asi":{"rollback_reason":"1MB recv_buf caused 2× regression on H2 GET 1M (2.51→4.57ms). Too-large Cstruct alloc and Cstruct.to_string likely cause GC pressure. 256KB was the sweet spot.","next_action_hint":"Try 128KB recv_buf as an intermediate point, or try optimizing the Informational_filter Buffer.t output to use bytes instead of strings."}}
{"run":26,"commit":"79a72e0","metric":5.107,"metrics":{"eta_errors":0,"eta_h1_get_1k_ms":0.037,"eta_h2_get_1k_ms":0.082,"eta_h2_get_1m_ms":1.537,"eta_h2_post_1m_ms":3.451,"go_h1_get_1k_ms":0.022,"go_h2_get_1k_ms":0.028,"go_h2_get_1m_ms":0.448,"go_h2_post_1m_ms":1.863,"go_total_ms":2.361},"status":"keep","description":"perf: Security.observe batch-skip DATA payloads — 5.11ms total, H2 GET 1M 2.51→1.54ms (-0.97ms!)","timestamp":1779703680344,"segment":0,"confidence":2279.6739130434767,"asi":{"hypothesis":"Security.observe was called per-byte (Bigstringaf.get) for every payload byte. For 1MB that's 1M function calls. Batch-skipping payload_remaining bytes in arithmetic avoids ~1M per-byte iterations.","next_action_hint":"Try Informational_filter DATA pass-through without String.sub copies (oracle #4). Also try larger reader buffer separately from H2 read_buffer_size (oracle #2).","hypothesis_tested":"Security.observe batch-skip"}}
{"run":27,"commit":"807f20e","metric":4.994,"metrics":{"eta_errors":0,"eta_h1_get_1k_ms":0.039,"eta_h2_get_1k_ms":0.041,"eta_h2_get_1m_ms":1.591,"eta_h2_post_1m_ms":3.323,"go_h1_get_1k_ms":0.016,"go_h2_get_1k_ms":0.025,"go_h2_get_1m_ms":0.445,"go_h2_post_1m_ms":1.908,"go_total_ms":2.394},"status":"keep","description":"perf: Informational_filter zero-copy DATA pass-through — avoid String.sub for pass-through frames (4.99ms)","timestamp":1779703792474,"segment":0,"confidence":2140.3326530612276,"asi":{"hypothesis":"Eliminated String.sub copy for DATA/pass-through frames in Informational_filter by passing offset into handle_frame and using Buffer.add_substring. Saves ~1MB of allocation per 1MB response.","next_action_hint":"Try larger reader staging buffer (128KB-256KB) in Multiplexer.create_client_reader separately from H2 read_buffer_size (oracle #2).","hypothesis_tested":"Informational_filter zero-copy DATA"}}
{"run":28,"commit":"6cbfd76","metric":4.989,"metrics":{"eta_errors":0,"eta_h1_get_1k_ms":0.036,"eta_h2_get_1k_ms":0.042,"eta_h2_get_1m_ms":1.384,"eta_h2_post_1m_ms":3.527,"go_h1_get_1k_ms":0.018,"go_h2_get_1k_ms":0.025,"go_h2_get_1m_ms":0.457,"go_h2_post_1m_ms":1.966,"go_total_ms":2.466},"status":"keep","description":"perf: 128KB reader staging buffer (H2 GET 1M 1.59→1.38ms, total 4.99ms)","timestamp":1779703893758,"segment":0,"confidence":1945.7662337662316,"asi":{"hypothesis":"Larger reader staging buffer reduces number of read_more/Informational_filter calls for 1MB response. 128KB reader buffer improved H2 GET 1M from 1.59→1.38ms.","next_action_hint":"Try 256KB reader buffer. The 128KB→256KB step might have diminishing returns."}}
{"run":29,"commit":"1edd604","metric":4.606,"metrics":{"eta_errors":0,"eta_h1_get_1k_ms":0.046,"eta_h2_get_1k_ms":0.06,"eta_h2_get_1m_ms":1.339,"eta_h2_post_1m_ms":3.161,"go_h1_get_1k_ms":0.019,"go_h2_get_1k_ms":0.024,"go_h2_get_1m_ms":0.416,"go_h2_post_1m_ms":1.796,"go_total_ms":2.255},"status":"keep","description":"perf: eliminate Bigstringaf.of_string copy in H2 POST body writing — use write_string directly (4.61ms, POST 3.51→3.16ms)","timestamp":1779704064103,"segment":0,"confidence":1784.270408163265,"asi":{"hypothesis":"Bigstringaf.of_string copies bytes to bigstring (~1MB for POST body). Using Bytes.unsafe_to_string + write_string avoids this copy, saving 1MB allocation per POST.","next_action_hint":"Remaining gap: H2 GET 1M 1.34ms vs Go 0.42ms (TLS crypto), H2 POST 1M 3.16ms vs Go 1.80ms. Upgrading mirage-crypto/tls is blocked by digestif/OxCaml compatibility. Consider body_stream_async batching with state machine (oracle #7).","hypothesis_tested":"POST write_string optimization"}}
{"run":30,"commit":"9f666e1","metric":4.571,"metrics":{"eta_errors":0,"eta_h1_get_1k_ms":0.063,"eta_h2_get_1k_ms":0.044,"eta_h2_get_1m_ms":1.311,"eta_h2_post_1m_ms":3.153,"go_h1_get_1k_ms":0.024,"go_h2_get_1k_ms":0.027,"go_h2_get_1m_ms":0.454,"go_h2_post_1m_ms":1.837,"go_total_ms":2.341},"status":"keep","description":"Confirm stable at 4.57ms — no code changes, verifying noise floor (4.57ms vs 4.61ms)","timestamp":1779704111669,"segment":0,"confidence":1335.6919159770844,"asi":{"hypothesis_tested":"Stability check — no code changes"}}
{"run":31,"commit":"39eb060","metric":3.798,"metrics":{"eta_errors":0,"eta_h1_get_1k_ms":0.039,"eta_h2_get_1k_ms":0.042,"eta_h2_get_1m_ms":0.926,"eta_h2_post_1m_ms":2.791,"go_h1_get_1k_ms":0.018,"go_h2_get_1k_ms":0.024,"go_h2_get_1m_ms":0.423,"go_h2_post_1m_ms":1.814,"go_total_ms":2.278},"status":"keep","description":"perf: Informational_filter passthrough bypass — skip Bigstringaf.substring + copy_filtered for reads after first final response (3.80ms, H2 GET 1M 1.31→0.93ms!)","timestamp":1779704302651,"segment":0,"confidence":1039.5633663366339,"asi":{"hypothesis":"After the first final response, the Informational_filter always passes DATA frames through. By checking is_passthrough (no pending data + final_seen non-empty), we can skip Bigstringaf.substring + feed + take + copy_filtered entirely, saving ~1.5MB of string copying per 1MB response.","next_action_hint":"H2 GET 1M now 0.93ms vs Go 0.42ms (2.2×). Remaining gap is ~0.5ms TLS crypto (h2c baseline is 0.35ms). Upgrading mirage-crypto blocked by digestif/OxCaml. Try body_stream_async state-machine batching for marginal gains.","hypothesis_tested":"Informational_filter passthrough bypass"}}
{"run":32,"commit":"TBD","metric":3.996,"metrics":{"eta_errors":0,"eta_h1_get_1k_ms":0.036,"eta_h2_get_1k_ms":0.043,"eta_h2_get_1m_ms":1.073,"eta_h2_post_1m_ms":2.844,"go_h1_get_1k_ms":0.017,"go_h2_get_1k_ms":0.033,"go_h2_get_1m_ms":0.453,"go_h2_post_1m_ms":1.764,"go_total_ms":2.267},"status":"discard","description":"Noise check — 3.996ms vs 3.80ms best, host variation (~5%)","timestamp":1779704345939,"segment":0,"confidence":967.7041474654371,"asi":{"hypothesis_tested":"Stability check"}}
{"run":33,"commit":"4481b8f","metric":3.776,"metrics":{"eta_errors":0,"eta_h1_get_1k_ms":0.038,"eta_h2_get_1k_ms":0.075,"eta_h2_get_1m_ms":0.927,"eta_h2_post_1m_ms":2.736,"go_h1_get_1k_ms":0.019,"go_h2_get_1k_ms":0.034,"go_h2_get_1m_ms":0.47,"go_h2_post_1m_ms":1.757,"go_total_ms":2.279},"status":"keep","description":"perf: H2 read_buffer_size=64KB (retry — now works with 256KB reader buffer + passthrough bypass). POST 1M 2.83→2.74ms (3.78ms total)","timestamp":1779704416060,"segment":0,"confidence":905.1560344827585,"asi":{"hypothesis":"Previously read_buffer_size=64KB was rejected (regressed to 3.33ms), but that was before Security.observe and Informational_filter bottlenecks were fixed. With larger reader buffer (256KB vs 64KB default), 64KB frames now fit and reduce H2 frame processing overhead. POST 1M benefits from fewer request body DATA frames.","next_action_hint":"Try body_stream_async batching with state machine (oracle #7) for further per-chunk overhead reduction. The remaining gap is mostly TLS crypto (~0.5ms).","hypothesis_tested":"read_buffer_size=64KB retry"}}
{"run":34,"commit":"TBD","metric":4.03,"metrics":{"eta_errors":0,"eta_h1_get_1k_ms":0.038,"eta_h2_get_1k_ms":0.042,"eta_h2_get_1m_ms":0.987,"eta_h2_post_1m_ms":2.963,"go_h1_get_1k_ms":0.017,"go_h2_get_1k_ms":0.024,"go_h2_get_1m_ms":0.438,"go_h2_post_1m_ms":1.716,"go_total_ms":2.195},"status":"discard","description":"Revert: response_body_buffer_size=256KB — regressed H2 GET 1M 0.93→0.99ms, POST 2.74→2.96ms","timestamp":1779704897273,"segment":0,"confidence":903.5981067125642,"asi":{"rollback_reason":"Larger response body buffer (256KB vs 64KB) regressed both GET and POST. Faraday coalescence didn't reduce on_read callbacks enough to offset increased buffer allocation cost.","hypothesis_tested":"response_body_buffer_size 256KB"}}
{"run":35,"commit":"TBD","metric":3.849,"metrics":{"eta_errors":0,"eta_h1_get_1k_ms":0.039,"eta_h2_get_1k_ms":0.043,"eta_h2_get_1m_ms":0.94,"eta_h2_post_1m_ms":2.827,"go_h1_get_1k_ms":0.018,"go_h2_get_1k_ms":0.026,"go_h2_get_1m_ms":0.444,"go_h2_post_1m_ms":1.807,"go_total_ms":2.295},"status":"discard","description":"Revert: 128KB flush interval for POST body — within noise, no improvement","timestamp":1779704951375,"segment":0,"confidence":833.318253968253,"asi":{"rollback_reason":"Reducing flush frequency from 16 to 8 per 1MB POST body showed no improvement. Flush overhead is not the bottleneck (TLS encryption dominates).","hypothesis_tested":"POST body flush interval 128KB"}}
{"run":36,"commit":"1cc8eee","metric":3.792,"metrics":{"eta_errors":0,"eta_h1_get_1k_ms":0.036,"eta_h2_get_1k_ms":0.08,"eta_h2_get_1m_ms":1.001,"eta_h2_post_1m_ms":2.675,"go_h1_get_1k_ms":0.018,"go_h2_get_1k_ms":0.022,"go_h2_get_1m_ms":0.42,"go_h2_post_1m_ms":1.933,"go_total_ms":2.394},"status":"keep","description":"Confirm stable at 3.79ms — consistent with 3.78ms best (H2 GET 1M 1.00ms, POST 2.68ms)","timestamp":1779705098575,"segment":0,"confidence":752.1353868194838,"asi":{"hypothesis_tested":"Stability confirmation"}}
{"run":37,"commit":"TBD","metric":4.516,"metrics":{"eta_errors":0,"eta_h1_get_1k_ms":0.038,"eta_h2_get_1k_ms":0.135,"eta_h2_get_1m_ms":0.926,"eta_h2_post_1m_ms":3.417,"go_h1_get_1k_ms":0.02,"go_h2_get_1k_ms":0.052,"go_h2_get_1m_ms":0.442,"go_h2_post_1m_ms":2.319,"go_total_ms":2.833},"status":"discard","description":"Host noise — H2 GET 1k outlier (0.14ms), total 4.52ms. Best remains 3.78ms.","timestamp":1779705123625,"segment":0,"confidence":685.3661879895561}
{"run":38,"commit":"TBD","metric":4.132,"metrics":{"eta_errors":0,"eta_h1_get_1k_ms":0.036,"eta_h2_get_1k_ms":0.046,"eta_h2_get_1m_ms":1.059,"eta_h2_post_1m_ms":2.991,"go_h1_get_1k_ms":0.018,"go_h2_get_1k_ms":0.028,"go_h2_get_1m_ms":0.461,"go_h2_post_1m_ms":1.94,"go_total_ms":2.447},"status":"discard","description":"Revert: skip_filter option — elimination of Informational_filter didn't help, 4.13ms vs 3.78ms. The passthrough bypass already handles the common case.","timestamp":1779705379993,"segment":0,"confidence":678.5014539579967,"asi":{"rollback_reason":"skip_filter didn't improve over is_passthrough bypass. The passthrough mechanism is sufficient — it already skips filter for reads after first final response, which is ~75% of the data. The remaining first-read cost is small relative to TLS overhead.","hypothesis_tested":"skip_filter option"}}
{"run":39,"commit":"TBD","metric":4.276,"metrics":{"eta_errors":0,"eta_h1_get_1k_ms":0.044,"eta_h2_get_1k_ms":0.068,"eta_h2_get_1m_ms":1.184,"eta_h2_post_1m_ms":2.98,"go_h1_get_1k_ms":0.02,"go_h2_get_1k_ms":0.023,"go_h2_get_1m_ms":0.487,"go_h2_post_1m_ms":2.517,"go_total_ms":3.046},"status":"discard","description":"Host noise — Go also elevated (3.05ms vs normal 2.3ms). Best remains 3.78ms.","timestamp":1779705419822,"segment":0,"confidence":671.7728726807419}
{"run":40,"commit":"19be5f0","metric":3.827,"metrics":{"eta_errors":0,"eta_h1_get_1k_ms":0.038,"eta_h2_get_1k_ms":0.043,"eta_h2_get_1m_ms":0.91,"eta_h2_post_1m_ms":2.836,"go_h1_get_1k_ms":0.019,"go_h2_get_1k_ms":0.025,"go_h2_get_1m_ms":0.441,"go_h2_post_1m_ms":1.802,"go_total_ms":2.287},"status":"keep","description":"OxCaml: mutable record for body_async_state (ref bool → record) — within noise, 3.83ms vs 3.78ms best","timestamp":1779706611880,"segment":0,"confidence":512.3108075140278,"asi":{"hypothesis":"Replacing closure-captured `ref bool` with a single mutable record reduces heap objects and improves cache locality.","hypothesis_tested":"OxCaml mutable record state","next_action_hint":"OxCaml micro-optimizations confirmed at diminishing returns. Oracle's realistic ceiling is -0.08 to -0.18ms for plain H2. The read_all_fast (#1) and borrowed Bigstring API (#2) are the only remaining impactful options, both require API changes."}}
{"run":41,"commit":"TBD","metric":4.365,"metrics":{"eta_errors":0,"eta_h1_get_1k_ms":0.041,"eta_h2_get_1k_ms":0.055,"eta_h2_get_1m_ms":1.16,"eta_h2_post_1m_ms":3.109,"go_h1_get_1k_ms":0.038,"go_h2_get_1k_ms":0.036,"go_h2_get_1m_ms":0.453,"go_h2_post_1m_ms":2.046,"go_total_ms":2.573},"status":"discard","description":"Baseline confirmed at 4.37ms after reverting body_stream_fast. Best remains 3.78ms (#33).","timestamp":1779707210630,"segment":0,"confidence":414.0303627760253,"asi":{"rollback_reason":"body_stream_fast (pre-allocated read_all path) regressed — Eio.Promise overhead + reader-fiber blocking was slower than body_stream_async's mutex+queue approach. The oracle's #1 hypothesis didn't pan out."}}
{"run":42,"commit":"TBD","metric":4.274,"metrics":{"eta_errors":0,"eta_h1_get_1k_ms":0.04,"eta_h2_get_1k_ms":0.047,"eta_h2_get_1m_ms":1.216,"eta_h2_post_1m_ms":2.971,"go_h1_get_1k_ms":0.015,"go_h2_get_1k_ms":0.026,"go_h2_get_1m_ms":0.458,"go_h2_post_1m_ms":2.041,"go_total_ms":2.541},"status":"discard","description":"Final noise check — 4.27ms. Best remains 3.78ms (#33). Plateau confirmed.","timestamp":1779707234688,"segment":0,"confidence":381.8807055828333}
